{
  "redis": {
    "host": "localhost",
    "port": 6379,
    "db": 0
  },
  "postgres": {
    "host": "dev-database",
    "user": "idigbio",
    "password": "",
    "db_prefix": "idb_",
    "db_suffix": "_dev"
  },
  "elasticsearch": {
    "types": [
      "publishers",
      "recordsets",
      "mediarecords",
      "records" 
    ],
    "indexname": "0.0.1",
    "servers": [
        "dev-elasticsearch:9200"
    ]
  },
  "env": {
    "ENV": "dev",
    "IDB_UUID": "872733a2-67a3-4c54-aa76-862735a5f334",
    "IDB_APIKEY": "thisislocaldevIDB_APIKEY",
    "IDB_DBPASS": "",
    "IDB_REDIS_AUTH": "thisislocaldevIDB_REDIS_AUTH",
    "IDB_STORAGE_HOST": "dev-storage",
    "IDB_STORAGE_ACCESS_KEY": "minioadmin",
    "IDB_STORAGE_SECRET_KEY": "minioadmin",
    "IDB_CRYPT_KEY": "thisislocaldevIDB_CRYPT_KEY"
  }
}
